{
  "$schema": "https://json-schema.org/draft/2020-12/schema",
  "$id": "https://dabbler.ai/schemas/dual-surface-comparison.schema.json",
  "title": "DualSurfaceComparison",
  "description": "Set 070 S2 - the provenance-tagged merge of one dual-surface verification run (push + pull arms over the same committed state, provider and adversarial framing held equal). Written as dual-surface-comparison.json. Every finding is labeled by the surface(s) that caught it - push-only / pull-only / both. The load-bearing rule (from the Set 069 S6 floor-ratchet coverage lesson): a free-text description is NOT an identity - two findings merge to 'both' ONLY when they share a non-empty, operator/harness-assigned defectKey, never on wording. The runtime contract is the pure-Python validator ai_router.dual_surface_verify.validate_comparison_artifact, which also enforces cross-field invariants this schema cannot express: a 'both' finding's contributors must cover BOTH surfaces (and carry a defectKey), a 'push-only'/'pull-only' finding's contributors must be exactly that one surface, and provenanceComplete may be true only when no finding is unkeyed.",
  "type": "object",
  "additionalProperties": false,
  "required": [
    "schemaVersion",
    "kind",
    "sessionSetName",
    "comparedAt",
    "runTag",
    "committedRef",
    "provider",
    "model",
    "attestation",
    "provenanceComplete",
    "pushUnkeyed",
    "pullUnkeyed",
    "findings"
  ],
  "allOf": [
    {
      "$comment": "Set 072: schemaVersion 2 (the current writer) requires the 'mode' field carrying the arm-equality posture. Legacy schemaVersion 1 artifacts predate 'mode' and omit it. This mirrors validate_comparison_artifact, which requires mode on version 2 and tolerates its absence on version 1.",
      "if": {
        "properties": { "schemaVersion": { "const": 2 } },
        "required": ["schemaVersion"]
      },
      "then": { "required": ["mode"] }
    },
    {
      "$comment": "provenanceComplete=true requires both unkeyed counts to be 0 AND no finding may be unkeyed (defectKey == ''). Both halves are encoded here, matching validate_comparison_artifact exactly - a schema-only consumer rejects the same artifacts the runtime does.",
      "if": {
        "properties": { "provenanceComplete": { "const": true } },
        "required": ["provenanceComplete"]
      },
      "then": {
        "properties": {
          "pushUnkeyed": { "const": 0 },
          "pullUnkeyed": { "const": 0 },
          "findings": {
            "not": {
              "contains": {
                "type": "object",
                "properties": { "defectKey": { "const": "" } },
                "required": ["defectKey"]
              }
            }
          }
        }
      }
    }
  ],
  "properties": {
    "schemaVersion": { "type": "integer", "enum": [1, 2] },
    "kind": { "type": "string", "const": "dual_surface_comparison" },
    "mode": {
      "description": "Set 072: the arm-equality posture this run was produced under. 'equal-arms' (the steelman default - provider/model held EQUAL across arms, the only RETIRE-evidence shape) or 'matrix' (per-arm providers/models intentionally diverged to measure provider x surface interaction - a per-cell instrument the scorer rejects as RETIRE telemetry). Required on schemaVersion 2; absent on legacy version-1 artifacts.",
      "type": "string",
      "enum": ["equal-arms", "matrix"]
    },
    "sessionSetName": {
      "description": "The set this comparison belongs to (identity).",
      "type": "string",
      "minLength": 1,
      "pattern": "\\S"
    },
    "comparedAt": {
      "description": "ISO-8601 timestamp of the merge (the caller stamps it).",
      "type": "string",
      "minLength": 1,
      "pattern": "\\S"
    },
    "runTag": {
      "description": "How the run was triggered. 'sampled' = unbiased random-sample telemetry; 'opt-in' = operator/orchestrator operational high-assurance. The two are NEVER pooled by the scorer.",
      "type": "string",
      "enum": ["sampled", "opt-in"]
    },
    "committedRef": {
      "description": "The diff range the push arm reviewed (provenance), e.g. 'base..head' or 'base..WORKTREE'.",
      "type": "string",
      "minLength": 1,
      "pattern": "\\S"
    },
    "provider": { "type": "string", "minLength": 1, "pattern": "\\S" },
    "model": { "type": "string", "minLength": 1, "pattern": "\\S" },
    "attestation": {
      "description": "The equal-arms attestation echoed from the dual-surface run (provider/model/framing held equal across arms). Free-form object - the runner derives it.",
      "type": "object"
    },
    "provenanceComplete": {
      "description": "True only when EVERY finding on both arms carried a stable defectKey. When false the push-only/pull-only tallies are an UPPER BOUND (an unkeyed defect both arms caught appears as two single-arm entries). When true, pushUnkeyed and pullUnkeyed MUST both be 0 AND no finding may be unkeyed (defectKey == '') - the top-level if/then encodes BOTH halves, matching the runtime validator.",
      "type": "boolean"
    },
    "pushUnkeyed": {
      "description": "Count of push-arm findings with no defectKey (un-mergeable; left as single-surface entries).",
      "type": "integer",
      "minimum": 0
    },
    "pullUnkeyed": {
      "description": "Count of pull-arm findings with no defectKey (un-mergeable; left as single-surface entries).",
      "type": "integer",
      "minimum": 0
    },
    "notes": { "type": "string" },
    "findings": {
      "description": "The merged, provenance-tagged findings. May be empty (both arms clean).",
      "type": "array",
      "items": { "$ref": "#/$defs/MergedFinding" }
    }
  },
  "$defs": {
    "MergedFinding": {
      "type": "object",
      "additionalProperties": false,
      "required": [
        "defectKey",
        "provenance",
        "severity",
        "category",
        "surfaces",
        "contributors"
      ],
      "properties": {
        "defectKey": {
          "description": "The stable, operator/harness-assigned defect identity. Empty string for an unkeyed finding (always single-surface). On the Set 069 benchmark this is the ground-truth case id.",
          "type": "string"
        },
        "provenance": {
          "description": "Which surface(s) caught this defect. 'both' requires a defectKey and contributors covering both surfaces (enforced by the runtime validator).",
          "type": "string",
          "enum": ["push-only", "pull-only", "both"]
        },
        "severity": {
          "description": "The most-severe severity across contributing arms (verbatim, not normalized).",
          "type": "string"
        },
        "category": {
          "description": "The first non-empty contributing category.",
          "type": "string"
        },
        "surfaces": {
          "description": "The DISTINCT surface(s) that contributed (the de-duplicated summary of the contributors' surfaces). Full multiplicity is preserved in contributors.",
          "type": "array",
          "minItems": 1,
          "uniqueItems": true,
          "items": { "type": "string", "enum": ["push", "pull"] }
        },
        "contributors": {
          "description": "Each arm's contribution, attribution preserved (a merge never discards either arm's wording).",
          "type": "array",
          "minItems": 1,
          "items": { "$ref": "#/$defs/FindingContributor" }
        }
      }
    },
    "FindingContributor": {
      "type": "object",
      "additionalProperties": false,
      "required": ["surface", "description"],
      "properties": {
        "surface": { "type": "string", "enum": ["push", "pull"] },
        "description": { "type": "string", "minLength": 1, "pattern": "\\S" },
        "severity": { "type": "string" },
        "category": { "type": "string" }
      }
    }
  }
}
