{
  "schemaVersion": 1,
  "kind": "dual_surface_comparison",
  "sessionSetName": "070-dual-surface-verification-telemetry",
  "comparedAt": "2026-06-16T13:40:00+00:00",
  "runTag": "opt-in",
  "committedRef": "HEAD~1..HEAD",
  "provider": "anthropic",
  "model": "claude-sonnet-4-6",
  "attestation": {
    "providerEqual": true,
    "modelEqual": true,
    "framingEqual": true,
    "bothAdversarial": true
  },
  "provenanceComplete": true,
  "pushUnkeyed": 0,
  "pullUnkeyed": 0,
  "notes": "Example fixture: both arms held equal; every finding keyed to a ground-truth case.",
  "findings": [
    {
      "defectKey": "case-001",
      "provenance": "both",
      "severity": "Major",
      "category": "correctness",
      "surfaces": ["push", "pull"],
      "contributors": [
        {
          "surface": "push",
          "description": "Off-by-one in the snippet-visible loop bound.",
          "severity": "Major",
          "category": "correctness"
        },
        {
          "surface": "pull",
          "description": "The loop in foo.py reads one element past the end.",
          "severity": "Critical",
          "category": "correctness"
        }
      ]
    },
    {
      "defectKey": "case-002",
      "provenance": "pull-only",
      "severity": "Major",
      "category": "contract-drift",
      "surfaces": ["pull"],
      "contributors": [
        {
          "surface": "pull",
          "description": "Cross-file contract drift the snippet could not show.",
          "severity": "Major",
          "category": "contract-drift"
        }
      ]
    },
    {
      "defectKey": "case-003",
      "provenance": "push-only",
      "severity": "Minor",
      "category": "style",
      "surfaces": ["push"],
      "contributors": [
        {
          "surface": "push",
          "description": "A small naming nit visible in the diff snippet.",
          "severity": "Minor",
          "category": "style"
        }
      ]
    }
  ]
}
